name,album,year,lyrics
Headlines,Take Care,2011, i might be too strung out on compliments overdosed on confidence started not to give a fuck and stopped fearin the consequence drinkin every night because we drink to my accomplishments faded way too long im floatin in and out of consciousness and they sayin im back id agree with that i just take my time with all this shit i still believe in that i had someone tell me i fell off ooh i needed that and they want to see me pick back up well whered i leave it at i know i exaggerated things now i got it like that tuck my napkin in my shirt cause im just mobbin like that you know good and well that you dont want a problem like that you gon make someone around me catch a body like that no dont do it please dont do it cause one of us goes in and we all go through it and drizzy got the money so drizzy gonna pay it those my brothers i aint even gotta say it thats just something they know they know they know they know they know they know they know they know they know they know yeah they know yeah that the real is on the rise fuck them other guys i even gave em a chance to decide now its something they know they know they know they know i be yellin out money over everything money on my mind then she wanna ask when it got so empty tell her i apologize happened over time she says they miss the old drake girl dont tempt me if they dont get it theyll be over you that new shit that you got is overdue you better do what you supposed to do im like why i gotta be all that but still i cant deny the fact that its true listening to you expressin all them feelings soap opera rappers all these niggas sound like all my children and thats who you thinkin is about to come and make a killin i guess it really is just me myself and all my millions you know that they aint even got it like that you gon hype me up and make me catch a body like that cause i live for this it isnt just a hobby like that when they get my shit and play it i aint even gotta say it they know they know they know they know they know they know they know they know they know they know yeah they know yeah that the real is on the rise fuck them other guys i even gave em a chance to decide now its something they know they know they know they know i be yelling out money over everything money on my mind tell them i apologize it happened over time they know they know they know they know they know they know they know they know they know they know yeah i heard once that they would rather hear about memories than enemies rather hear what was or will be than what is rather hear how you got it over how much it cost you rather hear about findin yourself than how you lost you rather you make this an open letter about family and struggle and it takin forever about hearts that you ve broken and ties that you ve severed no doubt in my mind that ll make them feel better
Look What You’ve Done,Take Care,2011, it s like 09 in your basement and i m in love with nebby and i still love her but it fell through because i wasn t ready and your back hurt and your neck hurt and you smoking heavy and i sit next to you and i lecture you because those are deadly and then you ash it and we argue about spending money on bullshit and you tell me i m just like my father my one button you push it now its fuck you i hate you ill move out in a heartbeat and i leave out and you call me you tell me that you sorry you love me and i love you and your heart hurts mine does too and its just words and they cut deep but its our world its just us two i see painkillers on the kitchen counter i hate to see it all hurt so bad but maybe i wouldnt have worked this hard if you were healthy and it werent so bad uh maybe i should walk up the street and try and get a job at the bank cause leave it up to me j and neeks well probably end up robbing the bank then wayne calls up my phone conversation wasnt that long gets me a flight to houston in the morning oh its my time yeah its on hes thinking of signing me i come home we make a mixtape with 17 songs and almost get a grammy off of that thing they love your son man that boy gone you get the operation you dreamed of and i finally send you to rome i get to make good on my promise it all worked out girl we shoulda known cause you deserve it is this shit real should i pinch you after all the things that we been through i got you look what youve done look what youve done look what youve done for me now you knew that i was gonna be something when youre stressed out and you need something i got you look what youve done look what youve done its like 06 in your backyard im in love with jade and im still in love cus when its that real is when it doesnt fade and my father living in memphis now he cant come this way over some minor charges and child support that just wasnt paid damn boo hoo sad story black american dad story know that im your sisters kid but it still dont explain the love that you have for me i remember sneaking in your pool after school dances damn your house felt like the hamptons for all of my summer romances i never really had no one like you man this all new shit made the world i know bigger changed the way that i viewed it had all this fighting going on at the crib you would calm me down when i lose it told you i think im done acting im more in touch with the music you said either way ill be a star i could go so far talked to me you got to me then you d toss the keys and loan me your car yeah just a young kid in a drop top lexus hopin that i dont get arrested just another kid thats going through life so worried that i wont be accepted but i could do anything you said that and you meant that you took me places you spent that they said no we went back checks bounced but we bounced back i put all the money in your accounts back and i thank you i dont know where id really be without that it worked out man you deserve it is this shit real should i pinch you after all the things that we been through i got you look what youve done look what youve done look what youve done for me now you knew that i was gonna be something when youre stressed out and you need something i got you look what youve done look what youve done hi aubrey im here sitting with my son having a little talk and he knows how to get in touch with you now to let you know how grateful i am for your help in keeping me in this in this comfortable place all i can say aubrey is i remember the good times we had together and the times i used to look after you and i still have wonderful feelings about that so god bless you and i hope ill see you 
Hate Sleeping Alone,Take Care,2011, she says kiss me like you miss me fuck me like you hate me and when you re fucking someone else just fuck her like she aint me damn those words are scary those words are scary virgin mary i just tell her to spare me i was in love 2 years ago and gave the baggage to my ex it s all for her to carry bags she deserve to carry i hate that ho i make it so hard just to talk don t i i get off topic don t i i get it poppin don t i i ll end up stopping won t i and by the time i end up stopping you ll be rocking one of the rings you pointed out while shopping with a nigga don t lie she s losing it right now cause if i wasnt who i am she wouldve been moving in by now but instead were moving slow i guess shes used to it by now and she gives me all her trust and im abusing it right now but this money coming in is just confusing shit right now you just told me i aint shit and i guess im proving it right now id rather be with you but you are not around so ima call somebody up and see if they be down cause i hate sleeping alone i hate sleeping alone half the time we dont end up fucking i dont ask her for nothing you leave me in the morning i dont see her for months but i just hate sleeping alone i hate sleeping alone so she s here and were both so gone hotel to hotel girl i could use your company full name and birthday i book a flight you come to me but she dont want a weekend she wants all of me or none of me if she cant work with all of me then she say she done with me you say that you over me you always end up under me you know how it goes dont be crazy dont play dumb with me dont start with yo shit i put you back in your place she tells me i bet you wont you wont say that to my face and hang up yeah how dare you tell me its tougher for you like i dont hear about the niggas you fucking with too and whoever i be with they got nothing on you thats just something to do when theres nothing to do yeah but shes losing it right now she has choices she should make i think shes choosing it right now one more chance to make it right i think im using it right now you just said i never learn i guess im proving it right now id rather be with you but you are not around so ima call somebody up and see if they be down cause i hate sleeping alone i hate sleeping alone half the time we dont end up fucking i dont ask her for nothing you leave me in the morning i dont see her for months but i just hate sleeping alone i hate sleeping alone so she s here and were both so gone
Under Ground Kings,Take Care,2011, bridge over troubled water ice in my muddy water rich off a mixtape got rich off a mixtape probably shouldnt be driving it just got so much harder cant even see straight i cant even see it straight uh fuck with me i buy the shots live a little cause niggas die a lot and lie a lot but im the truth thats right i fucking said it the living proof that you ain t gotta die to get to heaven you girl you right there you look like you like this shit howd i know howd i know thats me on some psychic shit i can tell a lie if you ask me my whereabouts but i might talk that real if you ask me what i care about rap and bitches rappin bitches bitches and rappin rappin and bitches until all of it switches i swear its been 2 years since somebody asked me who i was im the greatest man i said that before i knew i was thats whats important what really happened before this when me and my crew was all about this rapper from new orleans singing walking like a man finger on the trigger i got money in my pocket im a uptown nigga ah with fame on my mind my girl on my nerves i was pushing myself to get something that i deserve that was back in the days acura days i was a cold dude im getting back to my ways people always ask how i got my nice things take my crown to the grave im an underground king i bet we can make tonight the greatest story ever told cause im down to spend whatever lately ive been on a roll and i do it for the city cause you know the city love a nigga do it for the city cause you know the city love a nigga do it for the city cause you know the city love a nigga do it for the city sometimes i need that romance sometimes i need that pole dance sometimes i need that stripper thats gon tell me that she dont dance tell me lies make it sound good make it sound good do me like the women from my town would leather with that woodgrain persian rugs on wood floors talking all the good things thats all im really good for memphis tennessee no see i start to go deep back and ridge crest with my seat back with yo gotti and e mack and these niggas got them diamonds glowing in they mouth and they rockin furs like its snowing in the south and every pretty girl tell me thats the shit that she like so why am i in class if this is who im trying to be like so i drop out lessons i was taught are quick to fade as soon i realize that turning papers in wont get me paid and if i don t do nothing ima ball im counting all day like a clock on the wall yeah i need that making major changes to the life im living i had no choice i had to prove i made the right decisions that was back in the days acura days i was a cold dude im getting back to my ways people always ask how i got my nice things take my crown to the grave im an underground king i bet we can make tonight the greatest story ever told cause im down to spend whatever lately ive been on a roll and i do it for the city cause you know the city love a nigga do it for the city cause you know the city love a nigga do it for the city cause you know the city love a nigga do it for the city 
Take Care,Take Care,2011, i know youve been hurt by someone else i can tell by the way you carry yourself if you let me heres what ill do ill take care of you ive loved and ive lost ive asked about you and they told me things but my mind didnt change and i still feel the same whats a life with no fun please dont be so ashamed ive had mine youve had yours we both know we know they wont get you like i will my only wish is i die real cause that truth hurts and those lies heal and you cant sleep thinking that he lies still so you cry still tears all on the pillowcase big girls all get a little taste ah pushing me away so i give her space ah dealing with a heart that i didnt break ill be there for you i will care for you i keep thinking you just dont know tryna run from that say you done with that on your face girl it just dont show when youre ready just say youre ready when all the baggage just aint as heavy and the partys over just dont forget me well change the pace and well just go slow you wont ever have to worry you wont ever have to hide youve seen all my mistakes so look me in my eyes cause if you let me here is what ill do ill take care of you ive loved and ive lost its my birthday ill get high if i want to cant deny that i want you but ill lie if i have to cause you dont say you love me to your friends when they ask you even though we both know that you do you do one time been in love one time you and all your girls in the club one time all so convinced that youre following your heart cause your mind dont control what it does sometimes we all have our nights though dont be so ashamed ive had mine youve had yours we both know we know you hate being alone well you aint the only one you hate the fact that you bought the dream and they sold you one you love your friends but somebody shouldve told you some to save you instead they say dont tell me i dont care if you hurt i dont tell you you dont care if youre true dont tell me i dont care if you hurt i dont tell you you dont care if youre true i know youve been hurt by someone else i can tell by the way you carry yourself if you let me heres what ill do ill take care of you ive loved and ive lost
Make Me Proud,Take Care,2011, i like a woman with a future and a past a little attitude problem all good it ll make the shit last don t make it too easy girl don t take it too fast yeah thats it right there thats it do it just like that only you can do it just like that and i love it when your hair still wet cause you just took a shower running on a treadmill and only eating salad sound so smart like you graduated college like you went to yale but you probably went to howard knowing you weekend in miami trying to study by the pool couple things due but you always get it done mightve been a time when i loved her too but you take that away and you ve always been the one one i wonder why the moon looks nice girl maybe it s just right for the night you said niggas coming on too strong girl they want you in their life as a wife thats why you want to have no sex why you want to protest why you want to fight for your right cause you don t love them boys pussy run everything fuck that noise i know things get hard but girl you got it girl you got it there you go can t you tell by how they looking at you everywhere you go wondering whats on your mind it must be hard to be that fine when all these muthafuckas wanna waste your time it s just amazing girl and all i can say is i m so im so im so im so im so proud of you i m so im so im so im so im so proud of you i m so im so im so im so im so proud of you everything s adding up you ve been through hell and back thats why you re bad as fuck and you b b b bet i am all of them bitches i m badder than mansions in malibu babylon but i never mention everything i dabble in and i always ride slow when i m straddling and my shit s so wet you gotta paddle in gotta r r row gotta row ya boat it s pink friday records and ovo done did the pop tour i m the realest still the best legal team so the deals is ill it s mac opi and a fragrance too apparel i m dominating every avenue cobblestone good view little gravel too gotta pay for the entourage travel too cause i m fl fl fly im flying high aint got time to talk just hi and bye bitch but baby if you ask me to take a break i ll give it all away don t care what the people say i ll be a million billion trillion miles away aha he asked my sign i said a sag i m a star sheriff badge whats the point if i m guarding double d up hoes dolly parton i know things get hard but girl you got it girl you got it there you go can t you tell by how they looking at you everywhere you go wondering whats on your mind it must be hard to be that fine when all these muthafuckas wanna waste your time it s just amazing girl all i can say is i m so im so im so im so im so proud of you i m so im so im so im so im so proud of you i m so im so im so im so im so proud of you everythings adding up youve been through hell and back thats why youre bad as fuck and you know you are and i know all i can say is i m so im so im so im so im so proud of you and i know all i can say is i m so im so im so im so im so im so i m so im so im so im so im so proud of you i m so im so im so im so im so proud of you i m so im so im so im so im so proud of you everything s adding up you ve been through hell and back thats why youre bad as fuck and you know you are
Cameras,Take Care,2011, word on road is the clique about to blow you aint gotta run and tell nobody they already know weve been living on a high theyve been talking on the low but its cool know you heard it all before thats why i asked you how you mean how you mean thought you knew about the team thats why i asked you how you mean how you mean thought you knew about the team how you mean how you mean what you know about the team man these niggas need to stop it they be crowding up the scene baby girl you need to stop it all that pride and self esteem got you angry about this girl im with in all them magazines baby she look like a star but only on camera only on camera only on camera it look like we in love but only on camera only on camera only on camera dont listen to the lies i swear they all lies you know i could be your knight in shining armor all tires trying to tell you im the one come and holla at me before im on the next ting ymcmb ooh finally got you right here tonight i ll ease your mind that s why i m calling on you and ooh soft your loves desire it s hard to stay away you keep me calling on you thats why i asked you how you mean how you mean thought you knew about the team thats why i asked you how you mean how you mean thought you knew about the team how you mean how you mean what you know about the team you just know what you get told girl i see behind the scene she spilled whiskey on her shirt she gonna have to get it cleaned she been going way too hard someone has to intervene baby she look like a star but only on camera only on camera only on camera it might look like i care but only on camera only on camera only on camera dont listen to the lies i swear they all lies you know i could be your knight in shining armor all tires girl they love me like im prince like the new king with the crown bunch of underground kings thought you knew how we get down ooh finally got you right here tonight i ll ease your mind that s why i m calling on you and ooh soft your loves desire it s hard to stay away you keep me calling on you how you mean how you mean thought you knew about the team just mail me my ring back cant keep that shit 
Shot for Me,Take Care,2011, i can see it in your eyes youre angry regret got shit on what youre feelin now mad cause he aint like me oh you mad cause nobody ever did it like me all the care i would take all the love that we made now youre trying to find somebody to replace what i gave to you its a shame you didnt keep it alisha catya i know that you gon hear this im the man yeah i said it bitch im the man dont you forget it the way you walk thats me the way you talk thats me the way youve got your hair up did you forget thats me and the voice in your speaker right now thats me thats me and the voice in your ear thats me cant you see that i made it yeah i made it first i made you who you are and then i made it and youre wasted with your latest yeah im the reason why you always getting faded take a shot for me take a shot for me take a shot for me a shot for me a shot for me ok look im honest girl i cant lie i miss you you and the music were the only things that id commit to i never cheated for the record back when i was with you but you believed in everything but me girl i dont get you she says i know you changed i never see you cause youre always busy doing things i really wish she had a different way of viewing things i think the city that were from just kinda ruined things its such a small place not much to do but talk and listen the men are jealous and the women all in competition and all your friends telling you stories that you often misinterpret and taint all the images of your mr perfect i could tell that you been crying all night drinking all summer prayin for your happiness hope that you recover this is one i know you hated when you heard it and its worse because you know that i deserve it take a shot for me take a shot for me take a shot for me a shot for me a shot for me may your neighbors respect you trouble neglect you angels protect you and heaven accept you
Practice,Take Care,2011, yeah cash money shit cash money shit i can tell that moneys got you working weve been talking for so long now were finally here in person i taste pain and regret in your sweat youve been waiting for me oh ho i can tell that you been practicing i can tell that you been practicing all those other men were practice they were practice yeah for me for me for me for me girl you look good wont you back that ass up you a fine motherfucker wont you back that ass up call me big daddy wont you back that ass up girl who is you playing with back that ass up you working with some ass yeah you bad yeah girl you working with some ass yeah you bad yeah girl you working with some ass yeah you bad yeah make a nigga spend his cash yeah his last yeah hoes frown when you passed yeah they mad yeah couple thousand on your bag yeah fuck yeah im a big tymer nigga yeah money flipper yeah get it understood yeah its all good yeah girl i know its real cause ive been around it you only want whats real you just never found it dont give them no more chances ooh girl they had their turn everything for a reason theres things you had to learn from them but when i get you to myself you know whats going down whats going down oh girl you look good wont you back that ass up you a fine motherfucker wont you back that ass up call me big daddy wont you back that ass up girl who is you playing with back that ass up you working with some ass yeah you bad yeah girl you working with some ass yeah you bad yeah yeah i know he messed up but a let a real nigga make it right let a real nigga make it right you deserve that much let me put something in your life let me put something in your life put something in your life you telling me its only been a couple other people that youve been with ima trust you ima give you the benefit of the doubt and ima love you you can even call me daddy give you someone to look up to all my girls from the 504 need to drop it right now need to drop it right now all my girls from the 504 need to drop it right now need to drop it right now all my girls from the 504 need to drop it right now need to drop it right now all my girls from the 504 need to drop it right now need to drop it right now oh after you back it up then stop after you back it up then stop babygirl after you back it up then stop after you back it up then stop i can tell that moneys got you working that your bodys so wet and were finally here in person i taste pain and regret in your sweat youve been waiting for me oh ho i can tell that you been practicing i can tell that you been practicing all those other men were practice they were practice yeah for me for me for me for me
