name,album,year,lyrics
Try Harder,Room for Improvement,2006, sometimes i feel like lohan and hilary duff are the only ones with enough to feel what im about to say in this song when they want you to be like somebody else and you just want to be yourself and you do it and get the feeling its wrong that there is when all the press articles happening and the cameras get to snapping and they try to make you out as a lie its ironic because you were just trying to please them by using logic and reason its a lose lose why even try when your ideas so frequently get rejected people just get neglected and they never really know how to feel phone calls is something that youre expecting for someone without the ethics and the motives to try and make them a mill you never noticed the fact you might be working without receiving the perks and they just wanna say that you aint around i mean theres always some blame to put on yourself instead of claiming that you couldnt help and maybe next time you aint in town you gonna try to try harder cuz try harder cuz try try try try and the managers make you succumb to pressure and if what you spittin is fresher than most of these rappers running the game certain people will copy whats in the past to turn the profit with cash theres time i would have done it the same i mean i got me a range also got me a guilty conscience that made you tell anybody i meet that i rent sometimes i wish that i would just chilled on the sneakers and watched the game from the bleachers because im really tend to need what i spent in a house that i promised to get my mother dont compensate for the other time i wasted out late at the club instead of sitting in once a week for some dinner im working hard on the winter so this album is a labor of love you say as long as im staying out of the streets and just spending money on beats that she can rest without a toss and a turn because she know that my reputation precedes me and people watch me on tv thats exactly why i often get burned but im gonna try to 
Intro (Room For Improvement),Room for Improvement,2006, yo whats going on this is drake and ima let you know what you about to witness this right here is a drake and dj smallz collaboration so im from canada my mans from down south ya understand the number one dj in the south to be exact you heard that in the vmas you heard that wherever he goes my man smalls is out there down south same time reppin for toronto canada ya know what i mean so this right here listening to right now is the official southern smoke special edition i call it the room for improvement mixtape cause im not perfect and i bet neither are you if you listening so you need to just accept whats there know what i mean but look you need to just let this play out from track one to track whatever however many i put on here you need to just listen to this cause look man this is the first time canadian down south my man smallz your boy drake you know what it is man so just tune in nigga
Drake’s Voice Mail Box #2,Room for Improvement,2006, what up this kim damn i ve been trying to get at you all week why don t you call me back okay i lied damn i swear just call me back hit it too why don t you just call me back 
U.P.A. (Outro),Room for Improvement,2006, welcome ladies and gentlemen to our annual recital here at the u p a urban pianist association here is the most talented student in my class aubrey drake graham it has taken a long time for him to get to this point do not get me wrong he s not perfect but he has come a long way since my meeting with his mother he has made improvement so aubrey show these people what you got man put the jamie foxx on them i won t be able to see you but i will be able to hear you from outside so i ll eat my greek salad and drink that grey goose you gave me mmmm anyways good luck hey don t mess up okay my ass is on the line hey what did i tell you about playing bad notes huh you re a failure just leave and take your damn grey goose with you 
Diplomatic Immunity,Scary Hours,2018, diplomatic immunity fuck em all that peace and that unity all that weak shitll ruin me fuck em yeah cause niggas started talkin to me like im slowin down opinions over statistics of course gassed off journalistic come at me and all youll get is the ballistic report booked a private room at wallys waiter twistin the cork i got multi colored rings like the olympics of course at award shows cuttin through the tension of course girls huggin me then askin me what scent that is boy i be walkin around the six like i invented it boy yeah who am i the do or die the one with the fewest lies and the truest ties they try to compare us but like a job straight outta high school theres no you and i i taught you everything you know now you got student pride all factual i call the house the embassy the studio the chapel i hate to travel i just pulled up on solána show the girls a natural i knew her way back when hollywood was international yeah the furthest ive been thats word to my ends word to the flags that belong in the hood of my benz very presidential i broke all the codes for zonin in my residential i broke spirits that i never meant to my body isnt much of a sacred temple with vodka and wine and sleep at the opposite times promise shit is gettin outta line like when you make a stencil or gettin outta line like when you break a pencil violatin the treaty of versailles champagne is the alias but no cease and desist in i i refuse to comply with regulations i listen to heavy metal for meditation no silence like sanders on the detroit lions get a run around and ill bury you where they wont find ya motor city casino im at the cage with my old license they tell me dont worry i got your money like osirus dirty 30 workin on me tired of women that may tag me in pictures airin my dirty laundry catering is from giorgio baldi robyns favorite shit is nice but i prefer madeo calamari rings and tomato i got the sauce and now shorties keep claimin preggo wakin up at 6 pm like where does the day go forecastin tornadoes brainstormin retaliation at dinner tables 2010 was when i lost my halo 2017 i lost a j lo a rotterdam trip had me on front page though i had to lay low hot topic like your everyday clothes closed off but i could never stay closed billboard awards i claimed 13 out in vegas like sureños black excellence but i guess when it comes to me its not the same though all goodie that just pushed me to do the things we all couldnt niggas stakin out the crib its all gravy protection that god gave me shit is complex like short niggas round tall ladies i gotta watch who im talkin to like its all ages ive seen buddin careers turn to sit around and talk about other careers judgin their peers knowledge from niggas who did not contribute to none of this here cover my ears my security government tier yeah advance the venue so we know the exits check the guest list if opps make an appearance at least its expected tell em i dont wanna link like a broken necklace ill be in better company with my own reflection mirror mirror on the ceiling of my suite in the royal palace the tv playin al jazeera inshallah i hope the mission keeps on gettin clearer whenever wherever ovo will always be together like shakira i love i love i love i love it baby i
Emotionless,Scorpion,2018, youve got me feeling emotions ayy higher ahhhhhhh youve got me fe you ohhhh dont link me dont hit me when you hear this and tell me your favorite song dont tell me how you knew it would be like this all along i know the truth is you wont love me until im gone and even then the thing that comes after is movin on i cant even capture the feeling i had at first meetin all my heroes like seein how magic works the people i look up to are goin from bad to worse their actions out of character even when they rehearse workin in the land of the free the home of the brave i gotta bring my brothers or else i feel out of place breakin speed records on roads that these niggas paved and they dont like that its written all on they face i dont know how ima make it out of here clean cant even keep track of who plays for the other team iconic duos rip and split at the seams good hearted people are takin it to extremes leavin me in limbo to question what i believe leavin me to ask whats their motive in makin peace leavin me to not trust anybody i meet leavin me to ask is there anybody like me youve got me fe you ohhhh youve got me fe you ohhhh ayy missin out on my years theres times when i wish i was where i was back when i used to wish i was here missin out on my days scrollin through life and fishin for praise opinions from total strangers take me out of my ways i try and see whos there on the other end of the shade most times its just somebody thats underaged thats probably just alone and afraid and lashin out so that someone else can feel they pain i always hear people complain about the place that they live that all the people here are fake and they got nothin to give cause they been starin at somebody elses version of shit that makes another city seem more excitin than it is i know a girl whose one goal was to visit rome then she finally got to rome and all she did was post pictures for people at home cause all that mattered was impressin everybody shes known i know another girl thats cryin out for help but her latest caption is leave me alone i know a girl happily married til she puts down her phone i know a girl that saves pictures from places shes flown to post later and make it look like she still on the go look at the way we live i wasnt hidin my kid from the world i was hidin the world from my kid from empty souls who just wake up and look to debate until you starin at your seed you can never relate breakin news in my life i dont run to the blogs the only ones i wanna tell are the ones i can call they always ask why let the story run if its false you know a wise man once said nothin at all im exhausted and drained i cant even pretend all these people takin miles when you give em an inch all these followers but who gon follow me to the end i guess ill make it to the end and ima find out then youve got me fe you ohhhh ayy higher higher youve got me fe you ohhhh ayy higher higher
Ratchet Happy Birthday,Scorpion,2018, its a fuckin celebration tonight we celebrate seems like times out of our control its a celebration oh oh its your birthday baby its your birthday yeah whos gonna love you on your worst day you talk so tough i know youre soft like buttercups reeses reeses dont be ridiculous just say your piece and peace up like ibiza cool your headtop you hotter than anita bakin baby tell me where i need to to be to feel and fill that emptiness inside you petty bullshit shouldnt excite you on your birthday its your brrrrrrr its your fuckin birthday tonight we celebrate seems like times out of our control its a celebration oh oh they tried it they went for it all year and youre still here just ignore it if it aint the real thing you dont want it gg ccs all on ya its your month and you know it and you know its real dont gotta say it for you and you know somebody home prayin for you you say play this shit they better play it on time and i miss the days that you was all mine havent been official in a long time so tell me where i need to to be to feel and fill that emptiness inside you petty bullshit shouldnt excite you on your birthday its your brrrrrrr its your fuckin birthday tonight we celebrate seems like times out of our control its a celebration oh oh oh its your fuckin birthday oh oh
Survival,Scorpion,2018, i been waitin on this yeah all of this disorder no addressin the crown is broken in pieces but theres more in my possession theres a whole lot in my possession who do you really love well thats sure to be in question my mount rushmore is me with four different expressions whos givin out this much return on investment after my run man how is that even a question after this summer man how is that even a ive had real philly niggas try to write my endin takin shots with the goat and talked about shots that we sendin ive had scuffles with bad boys that wasnt pretendin ive had too many nights to mention thats just the beginnin im pretty sure we got a label im still independent i fell back a hundred times when i dont get the credit seen this movie a hundred times i know where its headed realize someone gotta die when no onell dead it niggas gamblin with they life for some content thats the type of lottery that could get your top picked i am a cream of the crop nigga you niggas pop mollies my malis pop niggas house on both coasts but i live on the charts i have tea with the stars and i swim with the sharks and i see in the dark wasnt this cold at the start think my soul has been marked theres a hole in my heart yeah i was about to man i thought about it its unsettlin to talk about it free all of my niggas that they caught with it r i p my niggas that they caught without it this just the intro let me not get ahead of myself this is gods plan young man you said it yourself always got a ace up my sleeve for whatever was dealt daddy got suits like bernie mac he dresses himself i stopped askin myself and i started feelin myself now i gotta deal with all this drama and deal with myself i aint even have to cut the tie it severed itself this just the intro let me not get ahead of myself
Finesse,Scorpion,2018, yeah turn everything up yeah oh yeah turn everything up a little more i want my baby to have your eyes im going against my own advice should i do new york i cant decide fashion week is more your thing than mine i cant even lie id rather stay inside i cant do suit and tie cant be in a room with you and stand on different sides one thing at a time i have to learn to hide one thing at a time emotions running high i wish you felt alright just hitting my line all the time all the time all the you stay on my mind all the time all the time it takes some finesse i seen you finesse he cant know finesse you stay on my mind you and your sister too hot to handle things would get cancelled i would make time for you commitment going the distance im new to all of this it takes some finesse i seen you finesse he cant know finesse you stay on my mind
8 Out of 10,Scorpion,2018, too rich for who yall just got rich again who grips the mic and likes to kill they friends ive never been the type to make amends if shit was at a eight we like to we like to we like to yeah if shit was at a eight we like to make it ten 1da sent this in im goin up all the way i dont like to talk when theres nothin else left to say drizzy bout to drop the game is in disarray id tell you hear me out but we both know end of the day your sister is pressin play your trainer is pressin play your wifey your wifey your wifey your wifey i gotta breathe real deep when i catch an attitude i got a whole nother level that i can tap into max said they only blessed when they attached to you the only deadbeats is whatever beats i been rappin to and the product is still the best though its only good in my city because i said so just to fit the estate man i had to copperfield like presto voilà tada never a matter of could i or should i kiss my son on the forehead then kiss your ass goodbye as luck would have it ive settled into my role as the good guy i guess luck is on your side i guess luck is on your side all sevens no sixes rest easy get some shut eye hold on hold up but i miss makin em pay helipad from will smith crib straight to the stage three forum shows but i played staples today the neighborhood is smokey yall stay safe in this place drizzy bout to drop the game is in disarray id tell you hear me out but we both know end of the day your niggas is pressin play your nanny is pressin play your wifey your wifey your wifey your wifey had to go and hit reset now we here i been on top for three sets of three years i cant be around the niggas you minglin with i cant fly if i could sit on the wing of that shit i try to pay it less mind they been keepin tabs on me like im payin next time i think i sense a little fear from the other side white vans parked across the street real subtle guys yeah never a matter of could i or should i kiss my mom on the forehead then kiss your ass goodbye as luck would have it ive settled into my role as the good guy i guess luck is on your side i guess luck is on your side all sevens no sixes rest easy get some shut eye hold on hold up but i hahaha i cant argue with you no you mad look at you you mad you big mad haheheh im happy leave me alone i just want some money a lot of money i dont get paid to argue with you no who is you you aint nobody you mad
After Dark,Scorpion,2018, haha haha yeah ayy in the whip solo no ones gotta know knockin at your door i dont gotta work anymore you can put your phone down youre gonna need two hands you cant get enough girl you know i set it up for after dark late night like left eye im creepin assuming the worst cause i havent heard from you all weekend your silence is drivin me up the wall up the wall i cannot tell if youre duckin calls or missin calls cause youve been so patient i drink on the job and smoke on the job so i dont know how serious you take it cant offer much more youve heard it before that narrative for me isnt changin i wanna make you a priority i wanna let you know theres more to me i wanna have your faith restored in me ill be on my way in the whip solo no ones gotta know after dark knockin at your door i don t gotta work anymore after dark you can put your phone down you re gonna need two hands after dark you cant get enough girl you know i set it up for after dark late night me and you got you wet like the pool then im tryna dive in put some time in yeah get the vibe right get your mind right its gon be a long night put your feet in this water dont wanna get your hair wet weve hooked up a couple times we aint took it there yet you broke up with your man and aint been with nobody else you like fuck these niggas rather keep it to yourself he did you wrong he left you down bad now you cant trust nobody you said do anything but just dont lie to me i said i ride for you girl you said you ride for me umm pulled up to the show then we got ghost and when its after dark anything goes in the whip solo no ones gotta know after dark knockin at your door i don t gotta work anymore after dark you can put your phone down you re gonna need two hands after dark you cant get enough girl you know i set it up for after dark at the quiet storm taking you right there with hall oates moving you through the storm in what is now 19 minutes after 10 o clock thanks for your phone calls as we get you closer to your requests and dedications phone lines are open for you to send a love your love note dedications 644 9393 call me coming up we will head through your storm with troop fantasia chaka khan my funny valentine jill scott giving you whatever and more the selected music of mr luther vandross as we kick off your first hour of the most selective most seductive most relaxing four hours of the 93 7 it s al wood and you are safe soft and warm in the loving embrace of my storm on blk
March 14,Scorpion,2018, here we go yeah yesterday morning was crazy i had to come to terms with the fact that its not a maybe that shit is in stone sealed and signed she not my lover like billie jean but the kid is mine sandi used to tell me all it takes is one time and all it took was one time shit we only met two times two times and both times were nothin like the new times now its rough times im out here on front lines just tryin to make sure that i see him sometimes its breakin my spirit single father i hate when i hear it i used to challenge my parents on every album now im embarrassed to tell em i ended up as a co parent always promised the family unit i wanted it to be different because ive been through it but this is the harsh truth now and fairy tales are saved for the bedtime stories i tell you now i dont want you worry bout whose house you live at or who loves you more or whos not there who did what to who fore you got here nah look im too proud to let that come between me and you now realize i gotta think for two now i gotta make it i better make it i promise if im not dead then im dedicated this the first positive dna we ever celebrated i cant forget the looks on they faces got the news in miami that now we all got ones that we raisin tell gelo bring some mod rosé and the baccarats out for our cheers to the next generation but this champagne toast is short lived i got an empty crib in my empty crib i only met you one time introduced you to saint nick i think he mustve brought you like twenty gifts your mother say you growin so fast that they dont even really fit but man you know i still had to get it for my boy though you know you havent met your grandfather yet that nigga a trip he probably coulda did stand up yeah but at the same time hes a stand up and thats how you gon be when its time to man up october baby for ironys sake of course i got this 11 tatted for somebody now its yours and believe me i cant wait to get a hundred more sorry im ventin tryna cover ground they said that in two weeks youre supposed to come in town hopefully by the time you hear this me and your mother will have come around instead of always cuttin each other down god willin i got a good feelin you got a good spirit well talk more when you hear this my g im changing from boy to a man no one to guide me im all alone no one to cry on i need shelter from the rain to ease the pain of changing from boy to a man no one to guide me im all alone no one to cry on i need shelter from the rain to ease the pain of changing from boy to a man im all alone no one to cry on i need shelter from the rain to ease the pain of changing from boy to a man
Can’t Take a Joke,Scorpion,2018, ayo blast that shit maxx blast that shit back if you blastin ayy uberx to hidden hills give me somethin i can feel if they come to hidden hills then i know they know the deal we just right there up the road you could hit it with a stone i be out here on my own im just tryna set the tone ive been kicked when i was down none of that shit matter now niggas think they run the town til we run em out of town and they gotta relocate gotta dip from where they stay everything will be okay man just stay up out my way skid around ends with the bros and im kitted to the toes if i touch studio then we got one i be tryna laugh with the bros bout the opps that we know but they cant take a joke cause its not one think its cause we live by the code reputation to uphold makin me the one they gotta take the spot from i be tryna laugh with the bros but they cant take a joke ayo blast that shit maxx blast that shit back if you blastin yeah yeah back and forth to italy my comment section killin me i swear i get so passionate yall do not know the half of it i grew up with the reps up boys we crashin it and splashin in and when i say they crashin it i do not mean a accident im im still in the studio at 6 45 and my haters either on they way to work or they arrived and i gotta own the things i rap about just for my pride you know when it comes to pride i cant put that shit aside ive been kicked when i was down none of that shit matter now they be throwin in the towel i do yellowtail at tao they be watchin what they say especially when its to my face everything will be okay man just stay up out my way skid around ends with the bros and im kitted to the toes if i touch studio then we got one i be tryna laugh with the bros bout the opps that we know but they cant take a joke cause its not one think its cause we live by the code reputation to uphold makin me the one they gotta take the spot from i be tryna laugh with the bros but they cant take a joke
