name,album,year,lyrics
Glow,More Life,2017, watch out for me im bound to glow you better watch out for me im bound to glow your boy all glowed up every time we touch down bet it go up member doin shows aint nobody show up pour your heart out aint nobody show love they used to laugh when my whip was on the tow truck til me and bein broke finally broke up watch out for me im about to glow time to shake the dice time to change the li i ight no more 9 to 5 autopilot dri i ive used to work the fries now we supersi i ize we go suit and tie we gon touch the sky y y we so certified we so certifi i ied fuck you haters still thats an f y i i i they gon bang this here all summerti i ime watch out for me im about to glow yeah yeah turn me way up my voice is really low yeah yeah yeah yeah okay watch out why nigga top down i started out way down low started from the bottom now we here now watch out for me im about to glow we about to get the whole nine the whole nine we just landed on a gold mine we the new abu dhabi this is our time watch out for me im about to glow i just take the dreams ive been sold and sell em for more you already know watch out for me im about to glow hope i deal with karma fore my son do cause i be drivin round this bih with no sunroof man the glow got me feelin like im gunproof watch out for me im about to glow i still have my guard up blame this thing im part of tryin to avoid more confrontation i just gotta try harder takin the time to clear my mind cause soon as im able to let that go watch out for me im bound to glow through devotion blessed are the children we love yall too we believe if theres anything yall wanna do in life you need devotion can i hear right on through devotion blessed are the children we live for it clap your hands this evening come on yall i said its alright clap your hands this evening come on yall
KMT,More Life,2017, yeah yeah yeah yeah yeah yeah yeah okay okay okay i gave my bro an advance love is just not in my plans not even takin a chance studio right in my yaad im doin ten in a week how long i been on this streak dream about work in my sleep okay i got a lock on the streets shoutout to t he did three and he brought it in cause of me you dont know nothin bout me life for my bruddas is deep long as they all on they feet long as they pockets is greaze dust a man down with the pen its a sweep taller in person youll see when we meet i heard your new shit and im kissin my teeth jheeze you know dem ones hahaha yeah ahh mizzy with the quick extension ringin off thirty ive got bitches in the merky swervin lookin all curvy and you already know i love them breasts lookin all perky lookin all christmas gift wrapped lookin all turkey spen jumped out the ghost in a suit lookin all churchy whippin that white girl now this is that big bad this is gustavo look at them jokers look at that arsehole man are gettin bread now and this is that hard dough clap man dominant murder im a black man government earner couldve just slapped man but he wanted it further batman da na na da na october firm
Since Way Back,More Life,2017,part i yeah pool in my eyes as you beg i testify that i hate being alone but you finally got me out my zone i know and i miss you know when im tripping oh yes its difficult thank god im christian remember how this all begun just us my mama said you was bad news like dun dun dun dun you proved her right every single night oh my oh my cant close my eyes cant open my eyes dont know what to do im in some kind of mood youre so beautiful youre so beautiful we gotta listen to some old kelly you slipped out if you don t know already girl i know you know already girl i know you know already things are gettin hot and heavy things are gettin hot and heavy girl i know you know already girl i know you girl i know you girl i know you know already what havent we done before what is not already mine couldnt tell you whats not yours you said that you think about me every day saturday to saturday you see that ive been goin through it hopin everythings okay i just want to let you know everything these days is textual i just want to get a lil sexual with you cause i remember way way back with the waves under the wave cap you were someone elses wife in fact you didnt even look at me like that then it all just switched over time step by step and you know whats next girl i cant pretend we gon have to listen to some old kelly you slipped out if you dont know already girl i know you know already girl i know you know already things are gettin hot and heavy things are gettin hot and heavy girl i know you know already girl i know you know how its gon go down i know you babe girl i know you know already what havent we done before what is not already mine couldnt tell you whats not yours yeah you know already tell you whats not yours tell you whats not yours part ii six months since ive been back in the six and i cant help but wonder how youve been babe what are you on gotta let me know something what are you on gotta let me know something what are you on gotta let me know something wonder how youve been ive been out in bel air like will was these streets got so familiar malibu coast where i meditate book a plane home then i hesitate scared to see what i left behind its weighin heavy on my mind and i cant help but wonder how youve been babe what are you on gotta let me know something what are you on gotta let me know something what are you on gotta let me know something wonder how youve been babe r kelly you slipped out if you dont know already girl i know you know already girl i know you know already things are gettin hot and heavy things are gettin hot and heavy girl i know you know already girl i know you know how its gon go down
4422,More Life,2017, im runnin but cant run away you say you changed but you never change up 44 22 you build it up to break it halfway through just make the call 22 but youre just the same as i ever knew 44 22 you build it up to break it halfway through just make the call 22 but youre just the same as i ever knew 44 22 you build it up to break it halfway through just make the call 22 but youre just the same as i ever knew 44 22 you build it up to break it halfway through just make the call 22 but youre just the same as i ever knew 44 22 you build it up to break it halfway through just make the call 22 but youre just the same as i ever knew i know i fear trust i know i fear fear too much on my plate lookin up outer space pearly gates im runnin but cant run away you say you changed but you never change up
Free Smoke,More Life,2017, is it the strength of your feelings overthrowing your pain youll see new heights you ll be reaching and is it today that you will find your new release and in your wake ripple your sweet fate and more chune for your headtop so watch how you speak on my name you know yeah i couldnt get a bill paid you couldnt buy the real thing i was stayin up at yo place tryin to figure out the whole thing i saw people doin things almost gave up on the music thing but we all so spoiled now more life more everything must have never had your phone tapped all that yappin on the phone shit you must really love the road life all that never comin home shit free smoke free smoke ayy free smoke free smoke ayy free smoke free smoke ayy dom rosé toast hidden hills where i post i start my day slow silk pajamas when i wake though miraval to the face though i drunk text j lo old number so it bounce back boi 1da got the bounce back used to get paid for shows in front door money five ten twenties hand sanitize after you count that me and gibbo was about that eatin applebees and outback southwest no first class hilton rooms gotta double up writin our name on a double cup we ain t even have a tour bus girls wouldnt even think of recordin me i fall asleep in sororities i had some different priorities weezy had all the authority women i like was ignorin me now they like arent you adorable i know the question rhetorical i took the team plane from oracle mama never used to cook much used to chef kd now me and chef kd bet on shots for twenty gs i brought the game to its knees i make too much these days to ever say poor me where you at i never see you free smoke free smoke ayy free smoke free smoke ayy free smoke free smoke ayy niggas moves so waste please come outside the house and show yourself so i can say it to your face it s bound to happen man its gotta happen now so lets just get it out the way lot of niggas goin bad on me please one at a time i wanna move to dubai so i dont never have to kick it with none of you guys i didnt listen to hov on that old song when he told me pay it no mind i get more satisfaction outta goin at your head and seein all of you die and i seen a lot of you die free smoke free smoke ayy free smoke free smoke ayy free smoke free smoke ayy hidden hills where i post yeah ye already know yeah im the troublemaker in the neighborhood far as troublemakin goes yeah house party up the road yeah im not kid n play this kid doesnt play about the flow yeah yall keep playin with your nose yeah you get high and do the most yeah how you let the kid fightin ghost writin rumors turn you to a ghost oh you niggas got jokes free smoke free smoke baka yeah we outchea ya dun know eh its a ovo ting eh ya dun know eh its a east side ting eh ya dun know eh more life
Sacrifices,More Life,2017, wrote this shit january 21 baby girl i had to run ill be back a couple months kendall turned 21 was up the street with 21 they could see me online but they wont see me on the ones i got dubai plates in the california state i got her waitin at my place i got no baby on the way im talkin baby like stunna im talkin baby like face lost millions in the past im talkin maybe like eight couple niggas from the city wishin on a star could they be like drake sorry no not today you gotta find your own way big dog from the 6 im talkin dogg like nate my shit be raw out the gate i dont need another take 40 got house on the lake i aint know we had a lake she complainin how im late i aint know it was a date niggas see me in person first thing they say is i know you need a break hell naw i feel great ready now why wait like a kiss from a rose i could be the one to seal your whole fate so be careful what you think think about what you gon say gotta deal with people straight i got my 23s laced its a marathon not a sprint but i still gotta win the race yeah and im convinced i made sacrifices i been ballin ever since we seein so many blessings shit dont make no sense someone watchin over us so shout goes out to him yeah im convinced i made sacrifices i been ballin ever since yeah i did some wrong i had no choice in my defense someone watchin over us so shout goes out to 2 chainz im a real one few shows thats a mil run when she bust it down i said thanks for givin to me like a pilgrim cold worldll be chillin earmuffs on the children used to trap out the hilton got wood on the cartiers thats a face full of splinters count a bankroll for dinner this the wrong place to enter phone sex for breakfast all kinda women text us met her at the super bowl told her i stayed down the street from texas a town i stay down yeah its all in the wrist this one here out the fence trap jumpin like the carter mean it jumpin like vince moved on from the election introduced her to the plug cant believe they tried to take the connection ooh girl you a blessin fine ass be finessin yeah i love my fans but i dont wanna take pictures in the restroom drench god with the 6 god point guard and the two guard pretty girls like trap music so i woke up with my wood hard and im convinced i made sacrifices i been ballin ever since we seein so many blessings shit dont make no sense someone watchin over us so shout goes out to him yeah im convinced i made sacrifices i been ballin ever since yeah i did some wrong i had no choice in my defense someone watchin over us so shout goes out to back when i was 21 20 in the clip head one growin up i was a running back you never made me ran once i got shot sweat started runnin that shit was red like hunt but dont you think shits sweet im talkin sweet deer meat we aint doin too much talkin like the president i kill em neat i m talkin neat like freak im talkin neat like fleek im talkin neat like a geek you come with beef i eat a b im talkin b s spellin bee double r thats a rolls paint it yellow like its dairy im talkin rose like derrick im talkin rolls like a belly like a new car i got two keys tryna score the bucket like a chevy seat ima use your name like who is he you get it haha i said ima use a name like who is he got some gold on leprechaun sheesh deep sleep short for deceased big bezel on the patty i m talkin padi i meant patek dont try to take it i got guns im talkin guns not pellets i watch the game from the floor im talkin wood first mattress im talkin wood pants down i got my mink off a monkey im talkin monkey like jumanji all your diamonds partly sunny im talkin sunny like d sunny my diamonds wet it cost me money im talkin wet like its runnin im talkin wet like dasani huh and im convinced i made sacrifices i been ballin ever since we seein so many blessings shit dont make no sense someone watchin over us so shout goes out to him yeah im convinced i made sacrifices i been ballin ever since yeah i did some wrong i had no choice in my defense someone watchin over us so shout goes out to 
Do Not Disturb,More Life,2017, silence keeps cloudin me hand on my heart and i i wish time never mattered yeah stylin though dissin but got pictures with me smilin though all the things you need you still want problems though all the things i know i still been silent though yeah used to be at silvercity indigo used to be in lunchroom playin dominoes i dont want to have to go to funerals i gotta start sleepin at the studio i dont have no time to be no romeo all the love i need is at the rodeo all the love i need is here at ovo yeah all the girls i know are there with e and tho who knows where i end up when that shit gets old maybe it never gets old and thats just how it goes last table left in carbone callin plays on the rotary phone i take a glass of domina to go with me home might move our annual shit to the dome i need 40 000 people to see what im on yeah ducked a lot of spiteful moves i was an angry yute when i was writin views saw a side of myself that i just never knew i ll probably self destruct if i ever lose but i never do steady doin double shifts 1da doin the beat and i open up like a double click more blessings because im generous thirty seater plane for like ten of us remember when i bought sealey the fake chanel wallet she knew that shit was a fraud but never told me about it nowadays when we catchin up we just laugh about it cant describe what my life is like when she asks about it scary whenever i close my eyes at night wakin up to public statements about my private life i can never sleep til mornin on all my quiet nights but you can rest assure that my mind is right get no sick days i leave for like three months in six days never stick around to see shit change get lil updates texts in my inboxes have been poppin seasons go by like im binge watchin went from club palazzo in the bridge to club liv to not even showin up at a club less we doin bis i cant even party while a nigga pursuin this distractions will do you in in the truest sense especially people that want to lecture me and frame it like they just want the best for me or they check for me whatever splits it up so theres more for them and theres less for me they dont know they got to be faster than me to get to me no ones done it successfully 7am in germany cant believe that they heard of me last that i gotta do is always like surgery always tryin to let go of anything thatll burden me thats the reason you can feel the tension and the urgency last chance i get to make sure that you take it personally take this shit to heart its always executed perfectly if we do a song its like takin my kids to work with me you overnight celebrity you one day star swear i told you that im in this bitch for eternity i am a reflection of all of your insecurities behind closed doors a lot of 6 god worshipping done talk now cause theres other shit thats concernin me theres real ones around me i want to make sure they learn from me i want to see my dog but his grandmothers his surety he cant even dip out to see me in an emergency my life is centered round competition and currency takin summer off cause they tell me i need recovery maybe gettin back to my regular life will humble me ill be back in 2018 to give you the summary more life
Passionfruit,More Life,2017, hold on hold on fuck that fuck that shit hold on i got to start this mothafuckin record over again wait a minute fuck that shit still on this mothafuckin record ima play this mothafucka for yall ayy y all get some more drinks goin on ill sound a whole lot better listen seein you got ritualistic cleansin my soul of addiction for now cause im fallin apart yeah tension between us just like picket fences you got issues that i won t mention for now cause were fallin apart passionate from miles away passive with the things you say passin up on my old ways i cant blame you no no passionate from miles away passive with the things you say passin up on my old ways i can t blame you no no listen harder buildin trust from a distance i think we should rule out commitment for now cause were fallin apart leavin youre just doing that to get even dont pick up the pieces just leave it for now they keep fallin apart passionate from miles away passive with the things you say passin up on my old ways i cant blame you no no passionate from miles away passive with the things you say passin up on my old ways i cant blame you no no um trying to think of the right thing to say
Madiba Riddim,More Life,2017, i cannot tell who is my friend i need distance between me and them gonna have to teach me how to love you again god knows im trying god knows im trying for you god knows im trying god knows it pure mind and pure soul i possess he knows it anointed and protected i was chosen my heart is way too frozen to get broken i seen man turn fool for the money one too many times i seen some girls turn their back on their best friend from time i heard you say things that you cant take back girl no time i need you to go easy now and fix up one time i cannot tell who is my friend i need distance between me and them gonna have to teach me how to love you again god knows im trying god knows im trying for you god knows im trying people change im not surprised devils working overtime voodoo spells put on my life it wont work they all have tried i seen man turn fool for the money one too many times i seen some girls turn their back on their best friend from time i heard you say things that you cant take back girl no time i need you to go easy now and fix up one time i cannot tell who is my friend i need distance between me and them gonna have to teach me how to love you again god knows im trying god knows im trying for you god knows im trying you put food on the table for me aye alright fam soft i see you aye you pay my bills right its light youre a wasteman top story wah 
Teenage Fever,More Life,2017, your heart is hard to carry after dark youre to blame for what we could have been cause look at what we are your friends are scared to tell you you went too far funny that its always been all about you from the start i met someone new last night and we kicked it and im going back there tonight and you know whats on my mind this time going back there tonight and you know whats on my mind so if you had my love and i gave you all my trust would you comfort me and if somehow you knew that your love would be untrue would you lie to me if you had my love and i gave you all my trust would you comfort me and if somehow you knew that your love would be untrue would you lie to me out of body thats just how i feel when im around you shawty last night we didnt say it but girl we both thought it why second guess i should have stayed you say the word im on the way this shit feels like teenage fever im not scared of it she aint either why second guess i should have stayed cause you know whats on my mind so if you had my love and i gave you all my trust would you comfort me and if somehow you knew that your love would be untrue would you lie to me if you had my love and i gave you all my trust would you comfort me and if somehow you knew that your love would be untrue would you lie to me yeah slightly took a left turn there but very much 6am slightly been awake for 24 hours so please forgive me more ideas and stuff comin yeah yeah fam im wafflin but man is tired fam jesus christ
No Long Talk,More Life,2017, yeah yeah murda on tha beat so its not nice that s baka hes a no long talker quick to let the motherfuckin tec slam we don t need to hear about a next man youts talk down then they get ran left them get dipped from the whole ends if gilla call shots no questions g way til im restin but we still got love for the west end if its a chit chat ting better talk nice murda on the beat so its not nice skull gets hot then im not nice you tryna date her and she been let me wop twice now you man are on a diss ting just know man like chubbs hes a fixer if i ever gotta fix tings just know man like fif hes a sickaz you get tanned he don t miss things just know man like me i m a sixer and i oversee the whole thing yeah i pree the whole thing yeah i pree the whole thing preme got the err tucked cant see the whole thing niggas wanna talk splits now we need the whole thing man catch suckers then we re touchin somethin man gets wrappin when were suckin somethin man bat bat it then we buck or somethin if man start throwin then were chuckin somethin im on the best side got the tec lined in the whip on the left side on a death ride mac 10 and the spesh flies and the tec slide nutty shit like somethin just climbed out the x files textbook like its old school like in textiles lighty lookin healthy and she gets smiles home time grab a quick drink and she gets wild sexy and i rate that and her sex style back bent pussy ill fuck her somethin glue pussy like a nigga stuck or somethin saw the monster its like a truck or somethin man gone hollywood its like im buck or somethin you dun know its hollowman giggs right now just here with the big man drizzy you get me more life flex you dun know ovo and sn1 to the world brap
Skepta Interlude,More Life,2017, its a madness check my account its a madness block that account its a catfish check my account thats a madness check my account thats a madness block that account thats a catfish block that account thats a catfish you dont know me you better get to know me stand up tall right next to kobe a young g i had the weapon on me slice up work like pepperoni the police still arrest the homies no statement no testimony spit in your face with extra bogey its my time i dont flex a rollie on cloud 9 a mans extra cozy i might switch it up and direct a movie pussyholes tried to execute me died and came back as fela kuti dont phone me send a text to julie ovo mans so unruly south by ride out no suzuki got the austin powers a mans extra groovy front row jacket tailor made crackhead swag with the razor blade red umbrella when i make it rain my whole team winnin we dont play your game sound like me but they aint the same see them online tryna fake the fame they wanna bust jokes they think im damon wayans its a madness check my account its a madness block that account its a catfish block that account its a catfish check my account thats a madness block that account its a catfish block that account its a catfish yeah theyre nothin like me im a fuckin villain go against me thats a tough decision police wish i was stuck in prison fish eye lens on my tunnel vision real life greaze when i touch the riddim still the same guy when i touched a million record labels wanted us to listen but its greatness only for the love of britain i say it how it is and no fucks are given greaze so dont forget to remember me especially all my enemies keep your eyes on me with your jealousy the most solid gang that you will ever see just came back from the embassy check my crime sheet check my legacy and now im back on tour so what you tellin me yeah thats that boy from the magazine bust my dance at the cash machine make her back it up bounce on my trampoline like martin luther man i had a dream now its my world you can have the scene its a madness check my account its a madness block that account its a catfish block that account its a catfish check my account thats a madness check my account thats a madness block that account its a catfish block that account its a catfish
More Life [Note],More Life,2017,more life more time with family and friends more life ive still got vibrations to send more life they say that we could live forever at night i pray its true ive done so much in my short time and still theres more to do but if someone should come collecting sooner than were all expecting at least the life you lived was one for you drake
